CDE ID,CDE Name,Variable Name,Definition,Short Description,Question Text,Permissible Values,PV Descriptions,Data Type,Disease Specific Instructions,Disease Specific Reference,Population,"Classification (e.g., Core)",Version Number,Version Date,CRF Module / Guideline,Subdomain Name,Domain Name,Size,Input Restrictions,Min Value,Max Value,Measurement Type,External Id Loinc,External Id Snomed,External Id caDSR,External Id CDISC
C04807,Vital status,VitStatus,Status of participant/subject as alive or dead,Status of participant/subject as alive or dead,Vital status on discharge,Alive;Dead;Unknown,Alive;Dead;Unknown,Alphanumeric,Choose one.,No references available,Adult;Pediatric,Supplemental,3,21:25.6,Discharge Status,Discharge Information,Disease/Injury Related Events,,Single Pre-Defined Value Selected,,,,,,,
C04804,Hospital discharge date and time,HospitDischgDateTime,"Date (and time, if applicable and known) the participant/subject was discharged from the hospital","Date (and time, if applicable and known) the participant/subject was discharged from the hospital",Hospital discharge date and time,,,Date or Date & Time,"Record the date/time according to the ISO 8601, the International Standard for the representation of dates and times (http://www.iso.org/iso/home.html).  The date/time should be recorded to the level of granularity known (e.g., year, year and month, complete date plus hours and minutes, etc.).",No references available,Adult;Pediatric,Supplemental,3,54:08.2,Discharge Status,Discharge Information,Disease/Injury Related Events,,Free-Form Entry,,,,,,,
C04809,Hospital discharge destination type,HospDischrgDestTyp,Type of destination on completion of stabilization/evaluation in hospital,Type of destination on completion of stabilization/evaluation in hospital,Destination upon discharge from hospital,"Discharge to rehabilitation unit;Discharge to other hospital;Discharge to nursing home;Discharge to home/private residence;Not applicable - patient died;Other, specify;Unknown","Discharge to rehabilitation unit;Discharge to other hospital;Discharge to nursing home;Discharge to home/private residence;Not applicable - patient died;Other, specify;Unknown",Alphanumeric,Choose one.,No references available,Adult;Pediatric,Supplemental,3,21:25.6,Discharge Status,Discharge Information,Disease/Injury Related Events,,Single Pre-Defined Value Selected,,,,,,,
C04805,ICU discharge date time,ICUDischrgDateTime,Date and time the participant/subject was discharged from the intensive care unit (ICU) of the hospital,Date and time the participant/subject was discharged from the intensive care unit (ICU) of the hospital,ICU discharge date and time,,,Date or Date & Time,"Record the date/time according to the ISO 8601, the International Standard for the representation of dates and times (http://www.iso.org/iso/home.html).  The date/time should be recorded to the level of granularity known (e.g., year, year and month, complete date plus hours and minutes, etc.).",No references available,Adult;Pediatric,Supplemental,3,21:25.6,Discharge Status,Discharge Information,Disease/Injury Related Events,,Free-Form Entry,,,,,,,
C04806,ICU discharge destination type,ICUDischrgDestTyp,Type of destination on completion of stabilization/evaluation in the intensive care unit (ICU) of the hospital,Type of destination on completion of stabilization/evaluation in the intensive care unit (ICU) of the hospital,ICU discharge destination type,"Discharge to other ICU;Discharge to rehabilitation unit;Discharge to other hospital;Discharge to nursing home;Not applicable - patient died;Other, specify;Unknown;Discharge to general ward","Discharge to other ICU;Discharge to rehabilitation unit;Discharge to other hospital;Discharge to nursing home;Not applicable - patient died;Other, specify;Unknown;Discharge to general ward",Alphanumeric,Choose one.,No references available,Adult;Pediatric,Supplemental,3,21:25.6,Discharge Status,Discharge Information,Disease/Injury Related Events,,Single Pre-Defined Value Selected,,,,,,,