VD,TECHNIQUE,Enum,Optional,The specific method or approach used to deliver radiation to a targeted area within the body for the treatment of cancer or other medical conditions. Different techniques are employed to maximize the effectiveness of radiation therapy while minimizing damage to surrounding healthy tissues.,,_undefined_,_undefined_,_undefined_,,,
PD,,,,,,"EBRT, 3D Conformal",A form of external beam radiation therapy (EBRT) in which doctors to sculpt radiation beams to the shape of a tumor and deliver to the tumor from several angles.,ncit:C16035,,,
PD,,,,,,"EBRT, Intensity-Modulated","A form of external beam radiation therapy (EBRT) in which advanced software plans a precise dose of radiation, based on tumor size, shape and location. A computer-controlled device delivers the radiation in sculpted doses that match the 3-D geometrical shape of the tumor, including concave and complex shapes. The intensity of radiation beams can be adjusted across the treatment area in fractioned, separate beams as precision accuracy",ncit:C16135,,,
PD,,,,,,"EBRT, Stereotactic Radiosurgery",A form of external beam radiation therapy (EBRT) in which a high dose of radiation is delivered to a small area in the brain or head from many angles.,ncit:C15358,,,
PD,,,,,,"EBRT, Stereotactic Body","Stereotactic radiation therapy in which one or several maximum dose radiation treatments are delivered targeting cancers of the body, excluding the brain or spine.",ncit:C118286,Stereotactic ablative body radiotherapy,,
PD,,,,,,"EBRT, Tomotherapy","A type of external beam radiation therapy in which the radiation is delivered slice-by-slice, providing sequential delivery of radiation to different parts of the tumor. This method differs from other forms of radiation therapy in which the entire tumor volume is irradiated at one time.",ncit:C62731,Helical IMRT,,
PD,,,,,,"EBRT, Pencil Beam Scanning","A precise form of proton therapy that uses an electronically guided scanning system and magnets to deliver a proton beam that is millimeters wide. With this system, beam position and depth can be controlled, allowing for highly precise deposition of radiation to be delivered in all three dimensions of the tumor.",ncit:C165502,D4CGNote: ENERGY_TYPE = Proton,,
PD,,,,,,"EBRT, Double Scattering",,,D4CGNote: ENERGY_TYPE = Proton,,
PD,,,,,,"EBRT, Volume Modulated Arc Therapy",Radiation therapy delivered to the whole volume of target tissue by a single rotation of the linear accelerator gantry.,ncit:C104933,,,
PD,,,,,,"EBRT, NOS","External beam radiation therapy (EBRT), subtype not otherwise specified",,,,[GPOH].[A3.9].[Conventional]
PD,,,,,,Brachytherapy,"A type of radiation therapy in which radioactive material is placed inside the body, into a tumor or body cavity.",ncit:C15195,,,
PD,,,,,,Not Reported,Not provided or available.,ncit:C43234,,,
VD,ENERGY_TYPE,Enum,Optional,Treatment of a disease by means of exposure of the target or the whole body to radiation. Radiation therapy is often used as part of curative therapy and occasionally as a component of palliative treatment for cancer. Other uses include total body irradiation prior to transplantation.,ncit:C15313,_undefined_,_undefined_,_undefined_,,,
PD,,,,,,Photon,A type of radiation therapy that uses x-rays or gamma rays that come from a special machine called a linear accelerator (linac). The radiation dose is delivered at the surface of the body and goes into the tumor and through the body. Photon beam radiation therapy is different from proton beam therapy.,ncit:C104914,,,
PD,,,,,,Proton,A type of radiation therapy that uses x-rays or gamma rays that come from a special machine called a linear accelerator (linac). The radiation dose is delivered at the surface of the body and goes into the tumor and through the body. Photon beam radiation therapy is different from proton beam therapy.,ncit:C104914,,,
PD,,,,,,Electron,A fundamental particle with a negative charge.,ncit:C40428,,,
PD,,,,,,Not Reported,Not provided or available.,ncit:C43234,,,
,,,,,,,,,,,
,,,,,,,,,,,
DD,Treatment,,,,,,,,,,
TD,Biopsy And Surgical Procedures,,Optional,,,,,,,,
TG,One row per subject per procedure,,,,,,,,,,
VD,HONEST_BROKER_SUBJECT_ID,String,Mandatory,"The identifier assigned to the subject by the honest broker. An individual, organization or system acting for, or on behalf of, a covered entity to collect and provide health information to research investigators in such a manner whereby it would not be reasonably possible for the investigators or others to identify the corresponding patients-subjects directly or indirectly. The honest broker cannot be one of the investigators. The information provided to the investigators by the honest broker may incorporate linkage codes to permit information collation and/or subsequent inquiries (i.e., a ""re-identification code""), however the information linking this re- identification code to the patient's identity must be retained by the honest broker and subsequent inquiries are conducted through the honest broker.",ncit:C168949,_undefined_,_undefined_,_undefined_,,,
VD,AGE_AT_PROCEDURE,Integer,Mandatory,The age (in days) of the subject at the time of this procedure.,ncit:C175008,_undefined_,_undefined_,_undefined_,,,
VD,TIME_PERIOD_SUBMITTER_ID,String,Optional,"This is the SUBMITTER_ID of the time period (defined in the ""Time Period"" table) during which this observation takes place.",,_undefined_,_undefined_,_undefined_,ConditionalStatement: Mandatory if age at observation is not known.,,
VD,PROCEDURE,Enum,Mandatory,A categorization of surgical procedures by type or purpose.,ncit:C161601,_undefined_,_undefined_,_undefined_,,,
PD,,,,,,Surgery,"A diagnostic or treatment procedure performed by manual and/or instrumental means, often involving an incision and the removal or replacement of a diseased organ or tissue; of or relating to or involving or used in surgery or requiring or amenable to treatment by surgery.",ncit:C15329,,,
PD,,,,,,Biopsy,"The removal of tissue specimens or fluid from the living body for microscopic examination, performed to establish a diagnosis.",ncit:C15189,,,
PD,,,,,,Lymph Node Dissection,,,,,
PD,,,,,,Fine Needle Aspiration,The removal of tissue or fluid with a thin needle for examination under a microscope.,ncit:C15361,,,
PD,,,,,,Not Reported,Not provided or available.,ncit:C43234,,,
VD,BIOPSY_TYPE,Enum,Priority,"The removal of cells or tissues for examination by a pathologist. The pathologist may study the tissue under a microscope or perform other tests on the cells or tissue. There are many different types of biopsy procedures. The most common types include: (1) incisional biopsy, in which only a sample of tissue is removed; (2) excisional biopsy, in which an entire lump or suspicious area is removed; and (3) needle biopsy, in which a sample of tissue or fluid is removed with a needle. When a wide needle is used, the procedure is called a core biopsy. When a thin needle is used, the procedure is called a fine-needle aspiration biopsy. (Source: NCI Dictionary of Cancer Terms)",ncit:C15189,_undefined_,_undefined_,_undefined_,ConditionalStatement: If 'PROCEDURE' = 'Biopsy'.,,
PD,,,,,,Core Needle Biopsy,"The removal of a tissue sample using a needle with a relatively large diameter, for microscopic examination.",ncit:C15680,,,
PD,,,,,,Incisional Biopsy,A surgical procedure in which part of a lesion is removed for microscopic examination.,ncit:C15386,,,
PD,,,,,,Excisional Biopsy,A surgical procedure in which an entire lesion is removed for microscopic examination.,ncit:C15385,,,
PD,,,,,,Unknown,Reported as unknown by the data contributor.,ncit:C17998,,,
PD,,,,,,Not Reported,Not provided or available.,ncit:C43234,,,
VD,SURGERY_TYPE,Enum,Priority,A query about the type of resection.,ncit:C186756,_undefined_,_undefined_,_undefined_,ConditionalStatement: If 'PROCEDURE' = 'Surgery'.,,"Was RESECTION_TYPE, coordinate with OS"
PD,,,,,,Lymph Node Dissection,,,,,
PD,,,,,,Lung Resection,,,,,
PD,,,,,,Craniofacial Resection,,,,,
PD,,,,,,Not Reported,Not provided or available.,ncit:C43234,,,
VD,SITE,Enum,Priority,The anatomical site on which surgery was performed.,ncit:C164323,_undefined_,_undefined_,_undefined_,,,
PD,,,,,,Bone,Connective tissue that forms the skeletal components of the body.,ncit:C12366,,,
PD,,,,,,Brain,An organ composed of grey and white matter containing billions of neurons that is the center for intelligence and reasoning. It is protected by the bony cranium.,ncit:C12439,,,
PD,,,,,,Cervical Nodes,Any of the lymph nodes located in the neck.,ncit:C32298,,,
PD,,,,,,Liver,"A triangular-shaped organ located under the diaphragm in the right hypochondrium. It is the largest internal organ of the body, weighting up to 2 kg. Metabolism and bile secretion are its main functions. It is composed of cells which have the ability to regenerate.",ncit:C12392,,,
PD,,,,,,Lung,"One of a pair of viscera occupying the pulmonary cavities of the thorax, the organs of respiration in which aeration of the blood takes place. As a rule, the right lung is slightly larger than the left and is divided into three lobes (an upper, a middle, and a lower or basal), while the left has two lobes (an upper and a lower or basal). Each lung is irregularly conical in shape, presenting a blunt upper extremity (the apex), a concave base following the curve of the diaphragm, an outer convex surface (costal surface), an inner or mediastinal surface (mediastinal surface), a thin and sharp anterior border, and a thick and rounded posterior border.",ncit:C12468,,,
PD,,,,,,Nasopharynx,,,,,
PD,,,,,,Unknown,Reported as unknown by the data contributor.,ncit:C17998,,,
PD,,,,,,Not Reported,Not provided or available.,ncit:C43234,,,
VD,PROTOCOL_PROCEDURE,Enum,Optional,Was this procedure part of the treatment protocol?,ncit:C175038,_undefined_,_undefined_,_undefined_,,,
PD,,,,,,Yes,The affirmative response to a question.,ncit:C49488,,,
PD,,,,,,No,The non-affirmative response to a question.,ncit:C49487,,,
PD,,,,,,Not Reported,Not provided or available.,ncit:C43234,,,
VD,CLASSIFICATION,Enum,Optional,The classification of a tumor based primarily on histopathological characteristics.,ncit:C174459,_undefined_,_undefined_,_undefined_,,,
PD,,,,,,Primary,A tumor at the original site of origin.,ncit:C8509,,,
PD,,,,,,Regional,,,,,
PD,,,,,,Metastatic,A term referring to the clinical or pathologic observation of a tumor extension from its original site of growth to another anatomic site.,ncit:C14174,,,
PD,,,,,,Not Reported,Not provided or available.,ncit:C43234,,,
VD,LATERALITY,Enum,Optional,A qualifier for the side of the body the procedure is performed.,ncit:C117526,_undefined_,_undefined_,_undefined_,,,
PD,,,,,,Left,Being or located on or directed toward the side of the body to the west when facing north.,ncit:C25229,,,
PD,,,,,,Right,Being or located on or directed toward the side of the body to the east when facing north.,ncit:C25228,,,
PD,,,,,,Bilateral,Affecting both sides of the body or a matched pair of organs.,ncit:C13332,,,
PD,,,,,,Midline,"A medial line, especially the medial line or medial plane of the body (or some part of the body).",ncit:CC81170,,,
PD,,,,,,Unknown,Reported as unknown by the data contributor.,ncit:C17998,,,
PD,,,,,,Not Reported,Not provided or available.,ncit:C43234,,,
VD,PROCEDURE_EXTENT,Enum,Optional,"The degree to which the lesion has been cut out, or resected.",ncit:C157443,_undefined_,_undefined_,_undefined_,,,
PD,,,,,,Gross Total,"Surgical removal of an entire visible lesion, with no obvious lesion detected on post-operative evaluation; microscopic residual disease may be present.",ncit:C131672,,,
PD,,,,,,Complete Resection,Complete clearance of the tumor with histologically proved negative margins.,ncit:C175027,,,
PD,,,,,,Partial Resection,Surgical removal of a part of a lesion; some portion of the lesion is detectable on post-operative evaluation.,ncit:C131680,,,
PD,,,,,,Equivocal,"A laboratory test result that indicates that a specific disease, condition, or attribute being assessed is not clearly present or absent.",ncit:C178921,,,
PD,,,,,,Unknown,Reported as unknown by the data contributor.,ncit:C17998,,,
PD,,,,,,Not Reported,Not provided or available.,ncit:C43234,,,
VD,MARGINS,Enum,Optional,"The edge or border of the tissue removed in cancer surgery. The margin is described as negative or clean when the pathologist finds no cancer cells at the edge of the tissue, suggesting that all of the cancer has been removed. The margin is described as positive or involved when the pathologist finds cancer cells at the edge of the tissue, suggesting that all of the cancer has not been removed. (Source: NCI Dictionary of Cancer Terms)",ncit:C41227,_undefined_,_undefined_,_undefined_,,,
PD,,,,,,"R0 - Complete Resection, Negative Margins",No detectable presence of residual tumor after treatment,ncit:C139578,,,
PD,,,,,,"R1 - Complete Resection, Positive Margins",Presence of microscopic residual tumor after treatment.,ncit:C139579,,,
PD,,,,,,R2 - Gross Residual Disease,Presence of macroscopic residual tumor after treatment.,ncit:C139580,,,
PD,,,,,,Incomplete Resection,"A response that the resection was incomplete, between 10-90 percent.",ncit:C182305,,,
PD,,,,,,Biopsy Only,"The removal of tissue specimens or fluid from the living body for microscopic examination, performed to establish a diagnosis.",ncit:C15189,,,
PD,,,,,,Unknown,Reported as unknown by the data contributor.,ncit:C17998,,,
PD,,,,,,Not Reported,Not provided or available.,ncit:C43234,,,
VD,PROCEDURE_PURPOSE,Enum,Optional,The reason a procedure is performed.,ncit:C185526,_undefined_,_undefined_,_undefined_,,,
PD,,,,,,Surgical Resection of Distant Site,,,,,
PD,,,,,,Initial Diagnostic Procedure,,,,,
PD,,,,,,Second Look Surgery to Attempt Total Resection,,,,,
PD,,,,,,Biopsy of Distant Site for Staging,,,,,
PD,,,,,,Diagnostic Biopsy for Possible Recurrence,,,,,
,,,,,,,,,,,
,,,,,,,,,,,
DD,Treatment,,,,,,,,,,
TD,Protocol Treatment Modifications,,Optional,,,,,,,,
TG,One row per subject per modification per modification reason per toxicity detail,,,,,,,,,,
VD,HONEST_BROKER_SUBJECT_ID,String,Mandatory,"The identifier assigned to the subject by the honest broker. An individual, organization or system acting for, or on behalf of, a covered entity to collect and provide health information to research investigators in such a manner whereby it would not be reasonably possible for the investigators or others to identify the corresponding patients-subjects directly or indirectly. The honest broker cannot be one of the investigators. The information provided to the investigators by the honest broker may incorporate linkage codes to permit information collation and/or subsequent inquiries (i.e., a ""re-identification code""), however the information linking this re- identification code to the patient's identity must be retained by the honest broker and subsequent inquiries are conducted through the honest broker.",ncit:C168949,_undefined_,_undefined_,_undefined_,,,
VD,AGE_AT_MODIFICATION,Integer,Mandatory,The age (in days) of subject since the protocol treatment modification.,,_undefined_,_undefined_,_undefined_,,,
VD,TIME_PERIOD_SUBMITTER_ID,String,Optional,"This is the SUBMITTER_ID of the time period (defined in the ""Time Period"" table) during which this observation takes place.",,_undefined_,_undefined_,_undefined_,ConditionalStatement: Mandatory if age at observation is not known.,,
VD,MODIFICATION,Enum,Mandatory,The type of modification used.,ncit:C185632,_undefined_,_undefined_,_undefined_,,,
PD,,,,,,Dose Reduction,"An indication that a medication schedule was modified by subtraction, either by changing the frequency, strength or amount.",ncit:C49505,,,
PD,,,,,,New Agent Addition,The addition of a new drug to a treatment.,ncit:C185633,,,
PD,,,,,,Substitution,The act of putting one thing or person in the place of another.,ncit:C54071,,,
PD,,,,,,Discontinued,"To stop or end, permanently or temporarily.",ncit:C25484,,,
PD,,,,,,Delayed,Time during which some action is awaited; inactivity resulting in something being put off until a later time; the state of being slower or later.,ncit:C25476,,,
PD,,,,,,Not Given,There was no excuse provided.,ncit:C106487,,,
PD,,,,,,Unknown,Reported as unknown by the data contributor.,ncit:C17998,,,
PD,,,,,,Not Reported,Not provided or available.,ncit:C43234,,,
VD,REASON,Enum,Priority,The reasoning behind a treatment modification.,ncit:C185636,_undefined_,_undefined_,_undefined_,,,
PD,,,,,,"Toxicity, NOS",,,,,
PD,,,,,,Hematologic Toxicity,A treatment designed to reduce or prevent damage to the hematologic system due to adverse events from other drug therapies.,ncit:C15474,,,
PD,,,,,,Non-Hematologic Toxicity,A toxicity that impairs or damages other than the hematologic system.,ncit:C185641,,,
PD,,,,,,Surgical Complications,"A disease or disorder that occurs during, soon after or as a result of a surgical procedure.",ncit:C164157,,,
PD,,,,,,Scheduling Issues,A problem scheduling an event.,ncit:C1685642|ncit:C185642,,,
PD,,,,,,Drug Not Available,A particular drug is unavailable.,ncit:C185643,,,
PD,,,,,,Subject Non-Compliance,"Failure of a patient to follow medical advice, take medication as directed, or adhere to a prescribed course of treatment.",ncit:C91752,,,
PD,,,,,,Pre-Existing Organ Dysfunction,Organ dysfunction that was present prior to evaluation.,ncit:C185644,,,
PD,,,,,,Unknown,Reported as unknown by the data contributor.,ncit:C17998,,,
PD,,,,,,Not Reported,Not provided or available.,ncit:C43234,,,
VD,MODIFICATION_BASIS,Enum,Optional,The rationale for why an entity or event is changed.,ncit:C93529,_undefined_,_undefined_,_undefined_,,,
PD,,,,,,Per Protocol,Subject is receiving treatment based on protocol.,ncit:C181023,,,
PD,,,,,,Clinical Indication,Signs and/or symptoms leading a practitioner to recommend a particular clinical intervention.,ncit:C185637,,,
PD,,,,,,Unknown,Reported as unknown by the data contributor.,ncit:C17998,,,
PD,,,,,,Not Reported,Not provided or available.,ncit:C43234,,,
VD,ORIGINAL_AGENT,Enum,Optional,The first agent planned for a therapy.,ncit:C185650,_undefined_,_undefined_,_undefined_,,,
PD,,,,,,Amifostine,"The trihydrate form of a phosphorylated aminosulfhydryl compound. After dephosphorylation of amifostine by alkaline phosphatase to an active free sulfhydryl (thiol) metabolite, the thiol metabolite binds to and detoxifies cytotoxic platinum-containing metabolites of cisplatin and scavenges free radicals induced by cisplatin and ionizing radiation. The elevated activity of this agent in normal tissues results from both the relative abundance of alkaline phosphatase in normal tissues and the greater vascularity of normal tissues compared to tumor tissues.",ncit:C488,,,
PD,,,,,,Bleomycin,"A mixture of glycopeptide antineoplastic antibiotics isolated from the bacterium Streptomyces verticillus. Bleomycin forms complexes with iron that reduce molecular oxygen to superoxide and hydroxyl radicals which cause single- and double-stranded breaks in DNA; these reactive oxygen species also induce lipid peroxidation, carbohydrate oxidation, and alterations in prostaglandin synthesis and degradation.",ncit:C313,,,
PD,,,,,,Carboplatin,"A second-generation platinum compound with a broad spectrum of antineoplastic properties. Carboplatin contains a platinum atom complexed with two ammonia groups and a cyclobutane-dicarboxyl residue. This agent is activated intracellularly to form reactive platinum complexes that bind to nucleophilic groups such as GC-rich sites in DNA, thereby inducing intrastrand and interstrand DNA cross-links, as well as DNA-protein cross-links. These carboplatin-induced DNA and protein effects result in apoptosis and cell growth inhibition. This agent possesses tumoricidal activity similar to that of its parent compound, cisplatin, but is more stable and less toxic. (NCI04)",ncit:C1282,,,
PD,,,,,,Cisplatin,"An alkylating-like inorganic platinum agent (cis-diamminedichloroplatinum) with antineoplastic activity. Cisplatin forms highly reactive, charged, platinum complexes which bind to nucleophilic groups such as GC-rich sites in DNA inducing intrastrand and interstrand DNA cross-links, as well as DNA-protein cross-links. These cross-links result in apoptosis and cell growth inhibition.",ncit:C376,,,
PD,,,,,,Docetaxel,"A semi-synthetic, second-generation taxane derived from a compound found in the European yew tree, Taxus baccata. Docetaxel displays potent and broad antineoplastic properties; it binds to and stabilizes tubulin, thereby inhibiting microtubule disassembly which results in cell- cycle arrest at the G2/M phase and cell death. This agent also inhibits pro-angiogenic factors such as vascular endothelial growth factor (VEGF) and displays immunomodulatory and pro-inflammatory properties by inducing various mediators of the inflammatory response. Docetaxel has been studied for use as a radiation-sensitizing agent. (NCI04)",ncit:C1526,,,
PD,,,,,,Doxorubicin,"An anthracycline antibiotic with antineoplastic activity. Doxorubicin, isolated from the bacterium Streptomyces peucetius var. caesius, is the hydroxylated congener of daunorubicin. Doxorubicin intercalates between base pairs in the DNA helix, thereby preventing DNA replication and ultimately inhibiting protein synthesis. Additionally, doxorubicin inhibits topoisomerase II which results in an increased and stabilized cleavable enzyme-DNA linked complex during DNA replication and subsequently prevents the ligation of the nucleotide strand after double-strand breakage. Doxorubicin also forms oxygen free radicals resulting in cytotoxicity secondary to lipid peroxidation of cell membrane lipids; the formation of oxygen free radicals also contributes to the toxicity of the anthracycline antibiotics, namely the cardiac and cutaneous vascular effects.",ncit:C456,,,
PD,,,,,,Fluorouracil (5FU),"An antimetabolite fluoropyrimidine analog of the nucleoside pyrimidine with antineoplastic activity. Fluorouracil and its metabolites possess a number of different mechanisms of action. In vivo, fluoruracil is converted to the active metabolite 5-fluoroxyuridine monophosphate (F-UMP); replacing uracil, F-UMP incorporates into RNA and inhibits RNA processing, thereby inhibiting cell growth. Another active metabolite, 5-5-fluoro-2'-deoxyuridine-5'-O-monophosphate (F-dUMP), inhibits thymidylate synthase, resulting in the depletion of thymidine triphosphate (TTP), one of the four nucleotide triphosphates used in the in vivo synthesis of DNA. Other fluorouracil metabolites incorporate into both RNA and DNA; incorporation into RNA results in major effects on both RNA processing and functions.",ncit:C505,,,
PD,,,,,,Gemcitabine,"A broad-spectrum antimetabolite and deoxycytidine analogue with antineoplastic activity. Upon administration, gemcitabine is converted into the active metabolites difluorodeoxycytidine diphosphate (dFdCDP) and difluorodeoxycytidine triphosphate (dFdCTP) by deoxycytidine kinase. dFdCTP competes with deoxycytidine triphosphate (dCTP) and is incorporated into DNA. This locks DNA polymerase thereby resulting in ""masked termination"" during DNA replication. On the other hand, dFdCDP inhibits ribonucleotide reductase, thereby decreasing the deoxynucleotide pool available for DNA synthesis. The reduction in the intracellular concentration of dCTP potentiates the incorporation of dFdCTP into DNA.",ncit:C66876,,,
PD,,,,,,Interferon,"Human interferons have been classified into 3 groups: alpha, beta, and gamma. Both alpha- and beta-IFNs, previously designated type I, are acid-stable, but they differ immunologically and in regard to some biologic and physiochemical properties. The IFNs produced by virus-stimulated leukocytes (leukocyte IFNs) are predominantly of the alpha type. Those produced by lymphoblastoid cells are about 90% alpha and 10% beta. Induced fibroblasts produce mainly or exclusively the beta type. The alpha- and beta-IFNs differ widely in amino acid sequence. The gamma or immune IFNs, which are produced by T lymphocytes in response to mitogens or to antigens to which they are sensitized, are acid-labile and serologically distinct from alpha- and beta-IFNs. (from OMIM 147570)",ncit:C20493,,,
PD,,,,,,Ipilimumab,"A recombinant human immunoglobulin (Ig) G1 monoclonal antibody directed against the human T-cell receptor cytotoxic T-lymphocyte-associated antigen 4 (CTLA4), with immune checkpoint inhibitory and antineoplastic activities. Ipilimumab binds to CTLA4 expressed on T-cells and inhibits the CTLA4-mediated downregulation of T-cell activation. This leads to a cytotoxic T-lymphocyte (CTL)-mediated immune response against cancer cells. CTLA4, an inhibitory receptor and member of the immunoglobulin superfamily, plays a key role in the downregulation of the immune system.",ncit:C2654,,,
PD,,,,,,Methotrexate,"An antimetabolite and antifolate agent with antineoplastic and immunosuppressant activities. Methotrexate binds to and inhibits the enzyme dihydrofolate reductase, resulting in inhibition of purine nucleotide and thymidylate synthesis and, subsequently, inhibition of DNA and RNA syntheses. Methotrexate also exhibits potent immunosuppressant activity although the mechanism(s) of actions is unclear.",ncit:C642,,,
