VD,AGE_AT_MEDICATION_START,Integer,Mandatory,The age (in days) of the subject at the start of this medication treatment.,ncit:C172698,_undefined_,_undefined_,_undefined_,,,
VD,AGE_AT_MEDICATION_END,Integer,Optional,The age (in days) of the subject at the end of this medication treatment.,ncit:C172686,_undefined_,_undefined_,_undefined_,,,
VD,TIME_PERIOD_SUBMITTER_ID,String,Optional,"This is the SUBMITTER_ID of the time period (defined in the ""Time Period"" table) during which this observation takes place.",,_undefined_,_undefined_,_undefined_,ConditionalStatement: Mandatory if age at observation is not known.,,
VD,MEDICATION,Enum,Mandatory,"A dosage form that contains one or more active and/or inactive ingredients. Medications come in many dosage forms, including tablets, capsules, liquids, creams, and patches. They can also be given in different ways, such as by mouth, by infusion into a vein, or by drops that are put into the ear or eye. The form with the active ingredient is used to prevent, diagnose, treat, or relieve symptoms of a disease or abnormal condition. A medication that does not contain an active ingredient and is used in research studies is called a placebo. Also called drug product.",ncit:C459,_undefined_,_undefined_,_undefined_,"ConditionalStatement: If ""ADMINISTRATION_STATUS"" = ""Medication Administered"".",,
PD,,,,,,Amifostine,"The trihydrate form of a phosphorylated aminosulfhydryl compound. After dephosphorylation of amifostine by alkaline phosphatase to an active free sulfhydryl (thiol) metabolite, the thiol metabolite binds to and detoxifies cytotoxic platinum-containing metabolites of cisplatin and scavenges free radicals induced by cisplatin and ionizing radiation. The elevated activity of this agent in normal tissues results from both the relative abundance of alkaline phosphatase in normal tissues and the greater vascularity of normal tissues compared to tumor tissues.",ncit:C488,,,
PD,,,,,,Bleomycin,"A mixture of glycopeptide antineoplastic antibiotics isolated from the bacterium Streptomyces verticillus. Bleomycin forms complexes with iron that reduce molecular oxygen to superoxide and hydroxyl radicals which cause single- and double-stranded breaks in DNA; these reactive oxygen species also induce lipid peroxidation, carbohydrate oxidation, and alterations in prostaglandin synthesis and degradation.",ncit:C313,,,
PD,,,,,,Carboplatin,"A second-generation platinum compound with a broad spectrum of antineoplastic properties. Carboplatin contains a platinum atom complexed with two ammonia groups and a cyclobutane-dicarboxyl residue. This agent is activated intracellularly to form reactive platinum complexes that bind to nucleophilic groups such as GC-rich sites in DNA, thereby inducing intrastrand and interstrand DNA cross-links, as well as DNA-protein cross-links. These carboplatin-induced DNA and protein effects result in apoptosis and cell growth inhibition. This agent possesses tumoricidal activity similar to that of its parent compound, cisplatin, but is more stable and less toxic. (NCI04)",ncit:C1282,,,
PD,,,,,,Cisplatin,"An alkylating-like inorganic platinum agent (cis-diamminedichloroplatinum) with antineoplastic activity. Cisplatin forms highly reactive, charged, platinum complexes which bind to nucleophilic groups such as GC-rich sites in DNA inducing intrastrand and interstrand DNA cross-links, as well as DNA-protein cross-links. These cross-links result in apoptosis and cell growth inhibition.",ncit:C376,,,
PD,,,,,,Docetaxel,"A semi-synthetic, second-generation taxane derived from a compound found in the European yew tree, Taxus baccata. Docetaxel displays potent and broad antineoplastic properties; it binds to and stabilizes tubulin, thereby inhibiting microtubule disassembly which results in cell- cycle arrest at the G2/M phase and cell death. This agent also inhibits pro-angiogenic factors such as vascular endothelial growth factor (VEGF) and displays immunomodulatory and pro-inflammatory properties by inducing various mediators of the inflammatory response. Docetaxel has been studied for use as a radiation-sensitizing agent. (NCI04)",ncit:C1526,,,
PD,,,,,,Doxorubicin,"An anthracycline antibiotic with antineoplastic activity. Doxorubicin, isolated from the bacterium Streptomyces peucetius var. caesius, is the hydroxylated congener of daunorubicin. Doxorubicin intercalates between base pairs in the DNA helix, thereby preventing DNA replication and ultimately inhibiting protein synthesis. Additionally, doxorubicin inhibits topoisomerase II which results in an increased and stabilized cleavable enzyme-DNA linked complex during DNA replication and subsequently prevents the ligation of the nucleotide strand after double-strand breakage. Doxorubicin also forms oxygen free radicals resulting in cytotoxicity secondary to lipid peroxidation of cell membrane lipids; the formation of oxygen free radicals also contributes to the toxicity of the anthracycline antibiotics, namely the cardiac and cutaneous vascular effects.",ncit:C456,,,
PD,,,,,,Fluorouracil (5FU),"An antimetabolite fluoropyrimidine analog of the nucleoside pyrimidine with antineoplastic activity. Fluorouracil and its metabolites possess a number of different mechanisms of action. In vivo, fluoruracil is converted to the active metabolite 5-fluoroxyuridine monophosphate (F-UMP); replacing uracil, F-UMP incorporates into RNA and inhibits RNA processing, thereby inhibiting cell growth. Another active metabolite, 5-5-fluoro-2'-deoxyuridine-5'-O-monophosphate (F-dUMP), inhibits thymidylate synthase, resulting in the depletion of thymidine triphosphate (TTP), one of the four nucleotide triphosphates used in the in vivo synthesis of DNA. Other fluorouracil metabolites incorporate into both RNA and DNA; incorporation into RNA results in major effects on both RNA processing and functions.",ncit:C505,,,
PD,,,,,,Gemcitabine,"A broad-spectrum antimetabolite and deoxycytidine analogue with antineoplastic activity. Upon administration, gemcitabine is converted into the active metabolites difluorodeoxycytidine diphosphate (dFdCDP) and difluorodeoxycytidine triphosphate (dFdCTP) by deoxycytidine kinase. dFdCTP competes with deoxycytidine triphosphate (dCTP) and is incorporated into DNA. This locks DNA polymerase thereby resulting in ""masked termination"" during DNA replication. On the other hand, dFdCDP inhibits ribonucleotide reductase, thereby decreasing the deoxynucleotide pool available for DNA synthesis. The reduction in the intracellular concentration of dCTP potentiates the incorporation of dFdCTP into DNA.",ncit:C66876,,,
PD,,,,,,Interferon,"Human interferons have been classified into 3 groups: alpha, beta, and gamma. Both alpha- and beta-IFNs, previously designated type I, are acid-stable, but they differ immunologically and in regard to some biologic and physiochemical properties. The IFNs produced by virus-stimulated leukocytes (leukocyte IFNs) are predominantly of the alpha type. Those produced by lymphoblastoid cells are about 90% alpha and 10% beta. Induced fibroblasts produce mainly or exclusively the beta type. The alpha- and beta-IFNs differ widely in amino acid sequence. The gamma or immune IFNs, which are produced by T lymphocytes in response to mitogens or to antigens to which they are sensitized, are acid-labile and serologically distinct from alpha- and beta-IFNs. (from OMIM 147570)",ncit:C20493,,,
PD,,,,,,Ipilimumab,"A recombinant human immunoglobulin (Ig) G1 monoclonal antibody directed against the human T-cell receptor cytotoxic T-lymphocyte-associated antigen 4 (CTLA4), with immune checkpoint inhibitory and antineoplastic activities. Ipilimumab binds to CTLA4 expressed on T-cells and inhibits the CTLA4-mediated downregulation of T-cell activation. This leads to a cytotoxic T-lymphocyte (CTL)-mediated immune response against cancer cells. CTLA4, an inhibitory receptor and member of the immunoglobulin superfamily, plays a key role in the downregulation of the immune system.",ncit:C2654,,,
PD,,,,,,Methotrexate,"An antimetabolite and antifolate agent with antineoplastic and immunosuppressant activities. Methotrexate binds to and inhibits the enzyme dihydrofolate reductase, resulting in inhibition of purine nucleotide and thymidylate synthesis and, subsequently, inhibition of DNA and RNA syntheses. Methotrexate also exhibits potent immunosuppressant activity although the mechanism(s) of actions is unclear.",ncit:C642,,,
PD,,,,,,Nivolumab,"A fully human immunoglobulin (Ig) G4 monoclonal antibody directed against the negative immunoregulatory human cell surface receptor programmed death-1 (PD-1, PCD-1) with immune checkpoint inhibitory and antineoplastic activities. Upon administration, nivolumab binds to and blocks the activation of PD-1, an immunoglobulin superfamily (IgSF) transmembrane protein, by its ligands programmed cell death ligand 1 (PD-L1), which is overexpressed on certain cancer cells, and programmed cell death ligand 2 (PD-L2), which is primarily expressed on antigen-presenting cells (APCs). This results in the activation of T-cells and cell-mediated immune responses against tumor cells. Activated PD-1 negatively regulates T-cell activation and plays a key role in tumor evasion from host immunity.",ncit:C68814,,,
PD,,,,,,Paclitaxel,"A compound extracted from the Pacific yew tree Taxus brevifolia with antineoplastic activity. Paclitaxel binds to tubulin and inhibits the disassembly of microtubules, thereby resulting in the inhibition of cell division. This agent also induces apoptosis by binding to and blocking the function of the apoptosis inhibitor protein Bcl-2 (B-cell Leukemia 2). (NCI04)",ncit:C1411,,,
PD,,,,,,Pembrolizumab,"A humanized monoclonal immunoglobulin (Ig) G4 antibody directed against human cell surface receptor PD-1 (programmed death-1 or programmed cell death-1) with potential immune checkpoint inhibitory and antineoplastic activities. Upon administration, pembrolizumab binds to PD-1, an inhibitory signaling receptor expressed on the surface of activated T cells, and blocks the binding to and activation of PD-1 by its ligands, which results in the activation of T-cell-mediated immune responses against tumor cells. The ligands for PD-1 include programmed cell death ligand 1 (PD-L1), overexpressed on certain cancer cells, and programmed cell death ligand 2 (PD-L2), which is primarily expressed on APCs. Activated PD-1 negatively regulates T-cell activation and plays a key role in in tumor evasion from host immunity.",ncit:C106432,,,
PD,,,,,,Sodium Thiosulfate,"A water soluble salt and reducing agent that reacts with oxidizing agents. Although its exact mechanism of action is unknown, thiosulfate likely provides an exogenous source of sulfur, thereby hastening the detoxification of cyanide through the enzyme rhodanese (thiosulfate cyanide sulfurtransferase) which converts cyanide to the relatively nontoxic, excretable thiocyanate ion. In addition, this agent neutralizes the reactive alkylating species of nitrogen mustard, thereby decreasing skin toxicity related to nitrogen mustard extravasation. (NCI04)",ncit:C1230,,,
PD,,,,,,Tetrathiomolybdate (TM),"An orally bioavailable metal copper (Cu) chelator, with potential antiangiogenic, anti-metastatic and antitumor activities. Upon oral administration, tetrathiomolybdate (TM) targets and binds to copper and food protein in the gastrointestinal (GI) tract, thereby forming stable complexes and preventing copper uptake and reabsorption. Additionally, absorbed free TM targets and binds to copper and serum albumin in the bloodstream. This depletes systemic copper reserves and deprives the tumor microenvironment (TME) from copper. Chelation of copper by TM downregulates the expression of angiogenic factors of which copper is a cofactor, such as vascular endothelial growth factor (VEGF) and basic fibroblast growth factor (bFGF), and prevents the production of nuclear factor-kappa B (NF-kB). Copper deprivation also inhibits the activity and levels of copper-dependent angiogenic enzymes, such as vascular endothelial growth factor receptor (VEGFR). This modulates the activity of VEGFR-positive endothelial progenitor cells (EPCs) that are necessary for metastasis. EPC deficiency results in the inhibition of angiogenesis and prevents metastasis. TM also inhibits the activities of other copper-containing metalloenzymes, including superoxide dismutase 1 (SOD1) in endothelial cells, cytochrome C oxidase, vascular adhesion protein-1 (VAP-1), antioxidant 1 copper chaperone (ATOX-1) and matrix metalloproteinase 9 (MMP-9). Inhibition of these enzymes interferes with the activation of several signal transduction pathways required for cellular proliferation and angiogenesis. TM also inhibits the activity and levels of lysyl oxidase-like 2 (LOXL2; lysyl oxidase homolog 2), a copper dependent amine oxidase that is critical for modeling the pre-metastatic niche and promotes metastasis, tumor cell migration and invasiveness. In addition, copper depletion also attenuates the activation of host cells within the tumor microenvironment including cancer-associated fibroblasts (CAFs), modulates tumor associated macrophages (TAMs) and promotes cytotoxic T-lymphocyte (CTL)-mediated anti-tumor immune responses.",ncit:C160684,,,
PD,,,,,,Unknown,Reported as unknown by the data contributor.,ncit:C17998,,,
PD,,,,,,Not Reported,Not provided or available.,ncit:C43234,,,
VD,ADMINISTRATION_STATUS,Enum,Mandatory,The status of the medication administration.,ncit:C173297,_undefined_,_undefined_,_undefined_,,,
PD,,,,,,Medication Administered,An indication that medication was administered.,ncit:C173298,,,
PD,,,,,,Medication Not Administered,An indication that medication was not administered.,ncit:C173299,,,
PD,,,,,,Not Reported,Not provided or available.,ncit:C43234,,,
VD,PROTOCOL_MEDICATION,Enum,Optional,Was this medication part of the treatment protocol?,ncit:C175038,_undefined_,_undefined_,_undefined_,,,
PD,,,,,,Yes,The affirmative response to a question.,ncit:C49488,,,
PD,,,,,,No,The non-affirmative response to a question.,ncit:C49487,,,
PD,,,,,,Unknown,Reported as unknown by the data contributor.,ncit:C17998,,,
PD,,,,,,Not Reported,Not provided or available.,ncit:C43234,,,
VD,NUMBER_DOSES,Decimal,Optional,Number of times a dose of the medication was administered between the AGE_AT_MEDICATION_START and AGE_AT_MEDICATION_END values.,ncit:C173293,_undefined_,_undefined_,_undefined_,D4CGNote: Number of doses of chemotherapy agent administered over the indicated start and end time points | D4CGNote: Only fill in this variable if this information is available.,,
VD,TOTAL_DOSE_ADMINISTERED,Decimal,Optional,"Total amount of medication administered between the AGE_AT_MEDICATION_START and AGE_AT_MEDICATION values. Assuming all doses administered are the same amount of medication, this value should be equal to the amount of medication given at each dose multiplied by the number of doses.",ncit:C94394,_undefined_,_undefined_,_undefined_,D4CGNote: Total dose of the chemotherapy agent administered to the subject over the indicated start and end time points. | D4CGNote: Only fill in this variable if this information is available.,,
VD,TOTAL_DOSE_INTENDED,Decimal,Optional,"This is the total amount of medication that was intended to be administered either by trial protocol, by prescription, or other indicator at the time point of AGE_AT_MEDICATION_START. Often, this will be equal to TOTAL_DOSE_ADMINISTERED. If TOTAL_DOSE_ADMINISTERED and TOTAL_DOSE_INTENDED are different, this indicates a deviation from the protocol or plan and may be due to a variety of factors including patient intolerance, patient non-adherence, etc.",ncit:C173294,_undefined_,_undefined_,_undefined_,D4CGNote: Intention-to-treat total dose of the chemotherapy agent over the indicated start and end time points. | D4CGNote: Only fill in this variable if this information is available.,,
VD,TOTAL_DOSE_UNIT,Enum,Optional,The units of the total dose.,ncit:C17395,_undefined_,_undefined_,_undefined_,ConditionalStatement: If 'TOTAL_DOSE_ADMINISTERED' and 'TOTAL_DOSE_INTENDED' not null | D4CGNote: Unit for TOTAL_DOSE_ADMINISTERED and TOTAL_DOSE_INTENDED must be the same.,,
PD,,,,,,mg/m2,A metric unit of areal density equal to approximately 2.94935E-5 ounce per square yard. Also used as a dose calculation unit.,ncit:C67402,,,
PD,,,,,,mg/kilo,A unit of a mass fraction expressed as a number of milligrams of substance per kilogram of mixture. The unit is also used as a dose calculation unit.,ncit:C67401,,,
PD,,,,,,mg,A metric unit of mass equal to one thousandth of a gram or 1000 micrograms. One milligram equals approximately 0.015 432 grain or 35.274 x 10E-6 ounce.,ncit:C67402,,,
PD,,,,,,IU,"The unitage assigned by the WHO to International Biological Standards - substances, classed as biological according to the criteria provided by WHO Expert Committee on Biological Standardization (e.g. hormones, enzymes, and vaccines), to enable the results of biological and immunological assay procedures to be expressed in the same way throughout the world. The definition of an international unit is generally arbitrary and technical, and has to be officially approved by the International Conference for Unification of Formulae.",ncit:C48579,,,
PD,,,,,,IU/m2,A dose calculation unit expressed as a number of arbitrary units of biological activity (International Units) of substance per square meter of body surface area.,ncit:C67378,,,
VD,CYCLE_NUMBER,Integer,Optional,The number of the individual chemotherapeutic cycle.,ncit:C166208,_undefined_,_undefined_,_undefined_,,,Integer?
VD,CYCLES_PLANNED,Integer,Optional,,,_undefined_,_undefined_,_undefined_,,,
,,,,,,,,,,,
,,,,,,,,,,,
DD,Treatment,,,,,,,,,,
TD,Radiation Therapy,,Priority,,,,,,,,
TG,One row per subject per radiation therapy administration,,,,,,,,,,
VD,HONEST_BROKER_SUBJECT_ID,String,Mandatory,"The identifier assigned to the subject by the honest broker. An individual, organization or system acting for, or on behalf of, a covered entity to collect and provide health information to research investigators in such a manner whereby it would not be reasonably possible for the investigators or others to identify the corresponding patients-subjects directly or indirectly. The honest broker cannot be one of the investigators. The information provided to the investigators by the honest broker may incorporate linkage codes to permit information collation and/or subsequent inquiries (i.e., a ""re-identification code""), however the information linking this re- identification code to the patient's identity must be retained by the honest broker and subsequent inquiries are conducted through the honest broker.",ncit:C168949,_undefined_,_undefined_,_undefined_,,,
VD,AGE_AT_RT_START,Integer,Mandatory,The age (in days) of the subject at the start of this radiation treatment.,ncit:C172695,_undefined_,_undefined_,_undefined_,,,
VD,AGE_AT_RT_END,Integer,Optional,The age (in days) of the subject at the end of this radiation treatment.,ncit:C172696,_undefined_,_undefined_,_undefined_,,,
VD,TIME_PERIOD_SUBMITTER_ID,String,Optional,"This is the SUBMITTER_ID of the time period (defined in the ""Time Period"" table) during which this observation takes place.",,_undefined_,_undefined_,_undefined_,ConditionalStatement: Mandatory if age at observation is not known.,,
VD,SITE,Enum,Mandatory,The anatomic site of the radiation therapy.,ncit:C173281,_undefined_,_undefined_,_undefined_,,,
PD,,,,,,Nasopharynx,"The part of the pharynx in the back of the throat, at and above the soft palate. The nasopharynx is continuous with the nasal passages.",ncit:C12423,"D4CGNote: CLASSIFICATION = ""Primary""",,
PD,,,,,,Level I Nodes,,,"D4CGNote: CLASSIFICATION = ""Regional""",,
PD,,,,,,Level II Nodes,,,"D4CGNote: CLASSIFICATION = ""Regional""",,
PD,,,,,,Level III Nodes,,,"D4CGNote: CLASSIFICATION = ""Regional""",,
PD,,,,,,Level IV Nodes,,,"D4CGNote: CLASSIFICATION = ""Regional""",,
PD,,,,,,Level V Nodes,,,"D4CGNote: CLASSIFICATION = ""Regional""",,
PD,,,,,,Retropharyngeal Nodes,,,"D4CGNote: CLASSIFICATION = ""Regional""",,
PD,,,,,,"Regional Lymph Nodes, NOS",,,"D4CGNote: CLASSIFICATION = ""Regional""",,
PD,,,,,,Distant Lymph Nodes,An organ composed of grey and white matter containing billions of neurons that is the center for intelligence and reasoning. It is protected by the bony cranium.,ncit:C12439,"D4CGNote: CLASSIFICATION = ""Metastatic""",,
PD,,,,,,Bone,The structural organ comprised of specialized connective tissue that forms the skeletal components of the body.,ncit:C12366,"D4CGNote: CLASSIFICATION = ""Metastatic""",,
PD,,,,,,Lung,"One of a pair of viscera occupying the pulmonary cavities of the thorax, the organs of respiration in which aeration of the blood takes place. As a rule, the right lung is slightly larger than the left and is divided into three lobes (an upper, a middle, and a lower or basal), while the left has two lobes (an upper and a lower or basal). Each lung is irregularly conical in shape, presenting a blunt upper extremity (the apex), a concave base following the curve of the diaphragm, an outer convex surface (costal surface), an inner or mediastinal surface (mediastinal surface), a thin and sharp anterior border, and a thick and rounded posterior border.",ncit:C12468,"D4CGNote: CLASSIFICATION = ""Metastatic""",,
PD,,,,,,Liver,"A triangular-shaped organ located under the diaphragm in the right hypochondrium. It is the largest internal organ of the body, weighting up to 2 kg. Metabolism and bile secretion are its main functions. It is composed of cells which have the ability to regenerate.",ncit:C12392,"D4CGNote: CLASSIFICATION = ""Metastatic""",,
PD,,,,,,Brain,An organ composed of grey and white matter containing billions of neurons that is the center for intelligence and reasoning. It is protected by the bony cranium.,ncit:C12439,"D4CGNote: CLASSIFICATION = ""Metastatic""",,
PD,,,,,,Not Reported,Not provided or available.,ncit:C43234,,,
VD,CLASSIFICATION,Enum,Optional,The classification of a tumor based primarily on histopathological characteristics.,ncit:C174459,_undefined_,_undefined_,_undefined_,,,
PD,,,,,,Primary,A tumor at the original site of origin.,ncit:C8509,,,
PD,,,,,,Regional,A disease or condition that extends beyond the site and spreads into adjacent tissues and regional lymph nodes.,ncit:C41844,"D4CGNote: Includes 'PTV2"" and ""PTV3""",,
PD,,,,,,Metastatic,A term referring to the clinical or pathologic observation of a tumor extension from its original site of growth to another anatomic site.,ncit:C14174,,,
PD,,,,,,Not Reported,Not provided or available.,ncit:C43234,,,
VD,LATERALITY,Enum,Optional,The laterality intended for radiation therapy.,ncit:C175523,_undefined_,_undefined_,_undefined_,,,
PD,,,,,,Left,A finding indicating the tumor location is on the left side of the specimen.,ncit:C160200|ncit:C25229,,,
PD,,,,,,Right,A finding indicating the tumor location is on the right side of the specimen.,ncit:C160199|ncit:C25228,,,
PD,,,,,,Bilateral,A finding indicating the tumor location is on the both sides of the specimen.,ncit:C160201|ncit:C13332,,,
PD,,,,,,Midline,A finding indicating the tumor location is on the midline of the specimen.,ncit:C162614,,,
VD,DOSE,Decimal,Mandatory,The total radiation dose administered.,ncit:C173282,_undefined_,_undefined_,_undefined_,,,
VD,DOSE_UNIT,Enum,Mandatory,A unit of measurement of the dose of radiation received or absorbed.,ncit:C18068,_undefined_,_undefined_,_undefined_,,,
PD,,,,,,cGy,The metric unit of absorbed radiation dose equal to the absorption of one hundredth of joule of radiation energy per kilogram of matter.,ncit:C64693,,,
PD,,,,,,CGE,A unit of relative biological effectiveness of protons equivalent to 60 cobalt gamma rays.,ncit:C128269,,,
PD,,,,,,Not Reported,Not provided or available.,ncit:C43234,,,
VD,NUM_FRACTION,Decimal,Optional,The number of divided radiation doses received per day.,ncit:C175034,_undefined_,_undefined_,_undefined_,,,
VD,FRACTION_DOSE,Decimal,Optional,The amount of radiation delivered to the treatment area in a single session or fraction.,,_undefined_,_undefined_,_undefined_,,,
VD,FRACTION_DOSE_UNIT,Enum,Optional,A unit of measurement of the dose of radiation received or absorbed.,ncit:C18068,_undefined_,_undefined_,_undefined_,,,
PD,,,,,,Gy,"A SI derived unit of absorbed radiation dose. One gray is equal to an absorbed dose of one joule per kilogram of matter, or to 100 rads.",ncit:C18063,,,
PD,,,,,,cGy,The metric unit of absorbed radiation dose equal to the absorption of one hundredth of joule of radiation energy per kilogram of matter.,ncit:C64693,,,
PD,,,,,,CGE,A unit of relative biological effectiveness of protons equivalent to 60 cobalt gamma rays.,ncit:C128269,,,
PD,,,,,,Not Reported,Not provided or available.,ncit:C43234,,,
VD,BOOST_TYPE,Enum,Optional,,,_undefined_,_undefined_,_undefined_,,,
PD,,,,,,Simultaneous Integrated,"A modification of intensity modulated radiation therapy that allows for the simultaneous delivery of different dose levels to different target volumes within a single treatment fraction. This can result in better sparing of critical structures, more efficient delivery, shorter treatment duration, and better biologic effectiveness.",ncit:C121139,,,
PD,,,,,,Sequential,A specific approach in radiation therapy where a higher dose of radiation (a boost) is delivered to a tumor or a specific area sequentially after an initial course of treatment.,,,,
VD,TREATMENT_VOLUME,Enum,Optional,,,_undefined_,_undefined_,_undefined_,,,
PD,,,,,,PTV Low Risk,,,D4CGNote: Use for PTV3,,
PD,,,,,,PTV Intermediate Risk,,,D4CGNote: Use for PTV2,,
PD,,,,,,PTV High Risk,,,D4CGNote: Use for PTV1,,
